{
  "schema": "ev4-responsive-output@0.3.0",
  "source_packet_ref": "ev4-responsive-start-packet.sample.viewport-tree",
  "selected_route": "viewport_specific_variant_tree",
  "relationship_classification_ref": {
    "classification": "viewport_specific_variant",
    "confidence": "medium",
    "evidence_refs": [
      "desktop_tree.sample",
      "mobile_variant_mockup.sample"
    ]
  },
  "responsive_tree_output": {
    "mode": "viewport_tree",
    "summary": "Create a tablet/mobile tree because the responsive mockup uses a materially different composition.",
    "tree_ref": null,
    "viewport_tree": {
      "root": "mobile_section.root",
      "target_viewports": [
        "tablet",
        "mobile"
      ]
    }
  },
  "display_contract": {
    "breakpoint_scope": {
      "desktop": ">=1025px",
      "tablet": "768px-1024px",
      "mobile": "<=767px"
    },
    "display_rules": [
      {
        "node_ref": "desktop_section.root",
        "desktop": "active",
        "tablet": "inactive",
        "mobile": "inactive",
        "reason": "Desktop composition is not used in responsive variant route."
      },
      {
        "node_ref": "mobile_section.root",
        "desktop": "inactive",
        "tablet": "active",
        "mobile": "active",
        "reason": "Responsive variant is active on tablet and mobile."
      }
    ],
    "content_policy": "Meaningful content is preserved through the viewport variant tree.",
    "sync_policy": "Repeated content must be synced manually or through shared dynamic data."
  },
  "builder_handoff": {
    "mode": "viewport_specific_variant_tree",
    "steps": [
      {
        "step_id": "VT-001",
        "target_node": "mobile_section.root",
        "viewport": "mobile",
        "action": "Create the responsive variant tree from the mobile mockup.",
        "expected_result": "Mobile composition is represented as its own viewport tree."
      }
    ]
  },
  "validation_plan": {
    "required_checks": [
      "Confirm desktop section is not visible on mobile.",
      "Confirm mobile variant is not visible on desktop.",
      "Confirm duplicated content has a sync policy."
    ],
    "evidence_to_collect": [
      "desktop_after_build_screenshot",
      "tablet_after_build_screenshot",
      "mobile_after_build_screenshot"
    ],
    "claim_boundary": "This is a viewport tree handoff plan, not export or accessibility validation."
  },
  "final_review": {
    "handoff_ready": false,
    "reason": "Viewport tree route remains not handoff-ready until the tablet/mobile tree split unknown is resolved."
  },
  "unresolved_unknowns": [
    "Confirm whether tablet should share the mobile variant or receive its own tree."
  ],
  "forbidden_claims": [
    "production_ready",
    "release_ready",
    "pixel_perfect",
    "export_validated",
    "live_render_validated",
    "accessibility_passed"
  ],
  "decision_lineage": {
    "decision_family": "responsive_tree_architecture_route",
    "decision_card_ref": "kernel-decision-card:responsive-tree-architecture-route:v1",
    "selected_option": "viewport_specific_variant_tree",
    "rejected_options": [
      "same_tree_responsive_overrides",
      "hybrid_split_architecture",
      "blocked_pending_input"
    ],
    "evidence_refs": [
      "decision-evidence:architect-approved-candidate",
      "decision-evidence:builder-project-gate-package",
      "responsive-validation-evidence:viewport-plan"
    ],
    "evidence_state": "validated",
    "consumer_stage": "responsive_validation_output"
  }
}
