{
  "schema": "ev4-responsive-output@0.3.0",
  "source_packet_ref": "ev4-responsive-start-packet.sample.hybrid",
  "selected_route": "hybrid_split_architecture",
  "relationship_classification_ref": {
    "classification": "hybrid_split",
    "confidence": "medium",
    "evidence_refs": [
      "desktop_tree.sample",
      "tablet_mockup.sample",
      "mobile_mockup.sample"
    ]
  },
  "responsive_tree_output": {
    "mode": "hybrid",
    "summary": "Preserve shared headline content while routing the visual/card cluster into a responsive-specific tree plan.",
    "tree_ref": "desktop_tree.sample",
    "composite_plan": {
      "shared_parts": [
        "section.heading",
        "section.cta"
      ],
      "additional_tree_parts": [
        "mobile_feature_list"
      ]
    }
  },
  "display_contract": {
    "breakpoint_scope": {
      "desktop": ">=1025px",
      "tablet": "768px-1024px",
      "mobile": "<=767px"
    },
    "display_rules": [
      {
        "node_ref": "section.heading",
        "desktop": "active",
        "tablet": "active",
        "mobile": "active",
        "reason": "Shared heading remains active across viewports."
      },
      {
        "node_ref": "desktop_visual_cluster",
        "desktop": "active",
        "tablet": "inactive",
        "mobile": "inactive",
        "reason": "Desktop connector geometry is not portable to mobile."
      },
      {
        "node_ref": "mobile_feature_list",
        "desktop": "inactive",
        "tablet": "active",
        "mobile": "active",
        "reason": "Responsive feature list replaces the desktop visual cluster."
      }
    ],
    "content_policy": "Shared content remains single-source where possible.",
    "sync_policy": "Feature labels in the mobile list must match the desktop feature labels."
  },
  "builder_handoff": {
    "mode": "hybrid_split_architecture",
    "steps": [
      {
        "step_id": "HY-001",
        "target_node": "desktop_visual_cluster",
        "viewport": "desktop",
        "action": "Keep the desktop visual cluster active only for desktop.",
        "expected_result": "Desktop connector composition remains intact."
      },
      {
        "step_id": "HY-002",
        "target_node": "mobile_feature_list",
        "viewport": "mobile",
        "action": "Create a compact responsive feature list using the same feature labels.",
        "expected_result": "Mobile content is readable without forcing desktop connector geometry."
      }
    ]
  },
  "validation_plan": {
    "required_checks": [
      "Confirm shared heading appears once per viewport.",
      "Confirm desktop visual cluster is not visible on mobile.",
      "Confirm mobile feature list preserves all meaningful feature labels."
    ],
    "evidence_to_collect": [
      "desktop_after_build_screenshot",
      "tablet_after_build_screenshot",
      "mobile_after_build_screenshot"
    ],
    "claim_boundary": "This is a hybrid handoff plan, not live render validation."
  },
  "final_review": {
    "handoff_ready": false,
    "reason": "Hybrid route includes shared, desktop-only, and responsive-specific ownership, but tablet connector simplification remains unresolved."
  },
  "unresolved_unknowns": [
    "Confirm whether decorative connector lines should be hidden or simplified on tablet."
  ],
  "forbidden_claims": [
    "production_ready",
    "release_ready",
    "pixel_perfect",
    "export_validated",
    "live_render_validated",
    "accessibility_passed"
  ],
  "decision_lineage": {
    "decision_family": "responsive_tree_architecture_route",
    "decision_card_ref": "kernel-decision-card:responsive-tree-architecture-route:v1",
    "selected_option": "hybrid_split_architecture",
    "rejected_options": [
      "same_tree_responsive_overrides",
      "viewport_specific_variant_tree",
      "blocked_pending_input"
    ],
    "evidence_refs": [
      "decision-evidence:architect-approved-candidate",
      "decision-evidence:builder-project-gate-package",
      "responsive-validation-evidence:viewport-plan"
    ],
    "evidence_state": "validated",
    "consumer_stage": "responsive_validation_output"
  }
}
